{
  "schema_version": 1,
  "source_revision": "c51da0afe453fe7b14cb127269ccd294f6983da9",
  "version": "0.6.6",
  "sequence": 1792608712560,
  "issued_at": 1792608712,
  "expires_at": 1793213512,
  "minimum_desktop_version": "0.1.0",
  "protocol": {
    "min": 1,
    "max": 1
  },
  "revoked_versions": [
    "0.4.0"
  ],
  "artifacts": [
    {
      "target": "aarch64-apple-darwin",
      "os": "darwin",
      "arch": "arm64",
      "redistribution_notice": "KALKIDAN_REDISTRIBUTION.md",
      "executable_sha256": "44be91ca6d2307b4545530ee51247b7e45fd7d4b9fbf3f01ccb4dc7a54fbcf26",
      "url": "https://github.com/verdictan/packages/releases/download/v0.6.6/verdictan-aarch64-apple-darwin.tar.gz",
      "sha256": "1206fcdd13e33cdb0746d879492120a7a1870ab9c5d35e6565381e7ca31609d6",
      "size": 89352463,
      "node_included": true,
      "minimum_os_version": "26.7.1",
      "required_runtime_dependencies": [
        "macOS system libraries",
        "system Keychain for account credentials"
      ]
    }
  ]
}
