[
  {
    "schema_version": 1,
    "version": "0.2.1",
    "sequence": 1,
    "issued_at": 1893456000,
    "expires_at": 1893542400,
    "minimum_desktop_version": "0.1.0",
    "protocol": {
      "min": 1,
      "max": 1
    },
    "signing": {
      "format": "sigstore-bundle",
      "key_id": "fixture-only-not-a-trust-anchor"
    },
    "revoked_versions": [],
    "artifacts": [
      {
        "target": "x86_64-unknown-linux-gnu",
        "os": "linux",
        "arch": "x64",
        "url": "https://example.invalid/verdictan-fixture.tar.gz",
        "sha256": "ba7816bf8f01cfea414140de5dae2223b00361a396177a9cb410ff61f20015ad",
        "size": 3,
        "signature_url": "https://example.invalid/verdictan-fixture.tar.gz.sigstore.json",
        "node_included": true,
        "required_runtime_dependencies": [
          "fixture-only-not-an-installable-artifact"
        ],
        "minimum_os_version": "26.7.1"
      }
    ]
  },
  {
    "schema_version": 1,
    "version": "0.2.1",
    "sequence": 1,
    "issued_at": 1893456000,
    "expires_at": 1893542400,
    "minimum_desktop_version": "0.1.0",
    "protocol": {
      "min": 1,
      "max": 1
    },
    "revoked_versions": [],
    "artifacts": [
      {
        "target": "x86_64-unknown-linux-gnu",
        "os": "linux",
        "arch": "x64",
        "url": "https://example.invalid/verdictan-fixture.tar.gz",
        "sha256": "ba7816bf8f01cfea414140de5dae2223b00361a396177a9cb410ff61f20015ad",
        "size": 3,
        "node_included": true,
        "required_runtime_dependencies": [
          "fixture-only-not-an-installable-artifact"
        ],
        "minimum_os_version": "26.7.1"
      }
    ]
  }
]
